{"type":"config","name":"1secimage Qwen Image 2.1 warm-path latency","metricName":"warm_512_total_seconds","metricUnit":"seconds","bestDirection":"lower","termination":"run until a validated 1-second path is found or the current optimization space is exhausted"}
{"type":"experiment","run":1,"metric":7.857,"status":"keep","description":"fresh default-device INT8 512px control","metrics":{"total_s":7.857,"text_s":2.281,"denoise_s":5.255,"vae_s":0.294,"peak_mib":15586},"asi":{"hypothesis":"default device is the latency baseline on a clean restarted server"}}
{"type":"experiment","run":2,"metric":41.969,"status":"discard","description":"CPU text encoder for INT8 512px","metrics":{"total_s":41.969,"text_s":36.928,"denoise_s":4.76,"vae_s":0.254,"peak_mib":11298},"asi":{"hypothesis":"moving the 8B text encoder to CPU reduces contention","rollback_reason":"text encoding is 16x slower and total latency regresses sharply despite lower VRAM"}}
{"type":"experiment","run":3,"metric":0.0,"status":"crash","description":"GPU INT8 prefix cache for INT8 512px","metrics":{"failure":"aimdo memory compile error at first sampler call"},"asi":{"hypothesis":"GPU int8 cache reduces denoise transfer and memory pressure","rollback_reason":"allocator/compiler rejected the execution before image output; do not treat as a cache result","next_action_hint":"test int4 or CPU/int8 only if allocator-safe, otherwise skip lossy cache modes"}}
{"type":"experiment","run":4,"metric":6.604,"status":"keep","description":"positive-only CFG1 with GPU lossless prefix cache","metrics":{"total_s":6.604,"text_s":1.328,"denoise_s":4.96,"vae_s":0.285,"peak_mib":15473.5},"asi":{"hypothesis":"skip the unused empty-negative text encoding and retain only positive conditioning at CFG 1","quality_gate":"run-1 PNG pixel-identical to GPU-cache CFGGuider baseline","baseline_s":7.358,"improvement_pct":10.25}}
{"type":"experiment","run":5,"metric":7.358,"status":"keep","description":"GPU lossless prefix cache","metrics":{"total_s":7.358,"text_s":2.014,"denoise_s":4.998,"vae_s":0.318,"peak_mib":15641},"asi":{"hypothesis":"force the prefix K/V cache to GPU","baseline_s":7.857,"improvement_pct":6.35,"quality_gate":"lossless storage; no output error"}}
{"type":"experiment","run":6,"metric":7.46,"status":"discard","description":"CPU lossless prefix cache","metrics":{"total_s":7.46,"text_s":1.984,"denoise_s":5.139,"peak_mib":15691.5},"asi":{"hypothesis":"force prefix K/V cache to CPU","rollback_reason":"slower than GPU cache and no memory advantage"}}
{"type":"experiment","run":7,"metric":11.182,"status":"keep","description":"positive-only CFG1 with GPU cache at 768px","metrics":{"total_s":11.182,"text_s":1.08,"denoise_s":9.502,"vae_s":0.543,"peak_mib":15677.5},"asi":{"hypothesis":"carry the 512px positive-only optimization to 768px","baseline_s":13.867,"improvement_pct":19.4,"quality_gate":"same 5-step model math; output pending visual review"}}
{"type":"experiment","run":8,"metric":5.425,"status":"keep","description":"dedicated 4-step Turbo LoRA with positive-only GPU cache at 512px","metrics":{"total_s":5.425,"text_s":1.157,"denoise_s":3.942,"vae_s":0.296,"peak_mib":15479},"asi":{"hypothesis":"matching four-step distilled adapter removes one full denoise pass","quality_gate":"pending fixed-seed image review"}}
{"type":"experiment","run":9,"metric":5.642,"status":"discard","description":"4-step Turbo path with zero VRAM reservation","metrics":{"total_s":5.642,"text_s":1.17,"denoise_s":4.161,"peak_mib":15509},"asi":{"hypothesis":"removing the 1 GiB reserve reduces offload pressure","rollback_reason":"median total 3.9% slower than the 1 GiB baseline despite more nominal free VRAM"}}
{"type":"experiment","run":10,"metric":3.696,"status":"discard","description":"off-contract 2-step Turbo schedule","metrics":{"total_s":3.696,"text_s":1.023,"denoise_s":2.32,"peak_mib":15458},"asi":{"hypothesis":"fewer steps can approach the one-second target","quality_gate":"CLIP 0.34408 and DINO distance 0.09316; reject as quality-insensitive off-contract probe"}}
{"type":"experiment","run":11,"metric":2.867,"status":"discard","description":"off-contract 1-step Turbo schedule","metrics":{"total_s":2.867,"text_s":1.028,"denoise_s":1.549,"peak_mib":15426},"asi":{"hypothesis":"one-step inference is viable","quality_gate":"CLIP 0.34710 but DINO distance 0.51799; structural collapse"}}
{"type":"experiment","run":12,"metric":5.475,"status":"discard","description":"4-step Turbo positive-only with auto prefix cache","metrics":{"total_s":5.475,"text_s":1.054,"denoise_s":4.091,"peak_mib":15475},"asi":{"hypothesis":"auto cache placement is a better policy than forced GPU","rollback_reason":"median 0.9% slower than forced GPU cache; retain forced GPU"}}
{"type":"experiment","run":13,"metric":5.448,"status":"discard","description":"4-step Turbo positive-only with prefix cache off","metrics":{"total_s":5.448,"text_s":1.007,"denoise_s":4.135,"peak_mib":15367},"asi":{"hypothesis":"prefix caching does not help at this size","rollback_reason":"lossless recompute is slightly slower than GPU cache; retain GPU cache"}}
{"type":"experiment","run":14,"metric":9.464,"status":"keep","description":"4-step Turbo positive-only GPU cache at 768px","metrics":{"total_s":9.464,"text_s":1.205,"denoise_s":7.653,"vae_s":0.542,"peak_mib":15467},"asi":{"hypothesis":"dedicated 4-step adapter scales to 768px","baseline_s":11.182,"improvement_pct":15.4,"quality_gate":"CLIP and DINO review required before final acceptance"}}
{"type":"experiment","run":15,"metric":5.161,"status":"discard","description":"four-step no-LoRA counterfactual","metrics":{"total_s":5.161,"text_s":1.071,"denoise_s":3.769,"peak_mib":15552},"asi":{"hypothesis":"schedule reduction alone explains the 4-step gain","rollback_reason":"mean absolute RGB difference 15.25 and RMS 36.43 versus Turbo output; adapter is essential"}}
{"type":"experiment","run":16,"metric":15.123,"status":"discard","description":"native INT8 QKV fusion with dedicated 4-step Turbo LoRA","metrics":{"total_s":15.123,"text_s":3.65,"denoise_s":10.821,"peak_mib":15608.5},"asi":{"hypothesis":"fusing Q/K/V projection rows reduces denoising overhead","rollback_reason":"LoRA patch count fell from 195 to 131 and latency regressed 179%; fused quantized adapter path is not viable"}}
{"type":"experiment","run":17,"metric":6.199,"status":"discard","description":"native INT8 QKV fusion without LoRA","metrics":{"total_s":6.199,"text_s":1.57,"denoise_s":4.196,"peak_mib":15221},"asi":{"hypothesis":"fusion is intrinsically beneficial outside LoRA","rollback_reason":"real no-LoRA control was 21% slower than the split path despite exact layer outputs"}}
{"type":"experiment","run":18,"metric":10.943745,"status":"discard","description":"4-step Turbo positive-only GPU cache with --disable-fast-disk","metrics":{"total_s":10.943745,"text_s":3.651664,"denoise_s":6.869964,"vae_s":0.362996,"peak_mib":15502},"asi":{"hypothesis":"unpinned RAM backing is faster than disk-backed dynamic offload for the H: checkpoints","baseline_s":5.424964,"improvement_pct":-101.762,"quality_gate":"all matched PNGs pixel-identical; policy-only change","rollback_reason":"warm first denoise step rose from about 1.45s to 4.34s and total median more than doubled; retain detected fast_disk policy","next_action_hint":"do not retry storage policy; test true per-block graph capture with stable buffers"}}
{"type":"experiment","run":19,"metric":8.915688,"status":"discard","description":"true per-block CUDA graph capture for cached Qwen Image 2.1 blocks","metrics":{"total_s":8.915688,"text_s":2.389119,"denoise_s":6.090743,"vae_s":0.380199,"peak_mib":15591,"graph_breaks":2,"rogue_allocations":11},"asi":{"hypothesis":"replaying each cached-prefix transformer block removes step launch and weight-scheduling overhead","baseline_s":5.424964,"improvement_pct":-64.351,"quality_gate":"failed; matched warm MAE 126.76 and RMSE 142.00","rollback_reason":"latency regressed 64%, the allocator reported two graph breaks and eleven rogue allocations, and replayed output was structurally wrong","next_action_hint":"do not retry direct per-block graph capture for variable-attention Qwen blocks; inspect the stable prefix-cache input/output contract only if a narrower graph boundary is available"}}
{"type":"experiment","run":20,"metric":2.368784,"status":"keep","description":"isolated PyTorch 2.14 cu130 runtime with native Comfy Kitchen CUDA kernels","metrics":{"total_s":2.368784,"text_s":0.979723,"denoise_s":1.062878,"vae_s":0.293721,"peak_mib":15425,"total_768_s":3.030086,"denoise_768_s":1.720814},"asi":{"hypothesis":"the native Comfy Kitchen CUDA int8_linear path removes the eager quantized-kernel bottleneck","baseline_s":5.424964,"improvement_pct":56.335,"quality_gate":"512px fixed-seed CLIP prompt delta -0.000043, CLIP image cosine 0.997742, DINO image cosine 0.993816; 768px median CLIP prompt delta 0, CLIP image cosine 0.998463, DINO image cosine 0.993272","backend":"torch 2.14.0+cu130; comfy-kitchen 0.2.35 CUDA backend enabled; int8_linear available; graph breaks 0; rogues 0","next_action_hint":"tune async-offload streams on cu130 and use the fastest VRAM-safe setting"}}
{"type":"experiment","run":21,"metric":1.768235,"status":"keep","description":"cu130 native CUDA kernels with one async-offload stream","metrics":{"total_s":1.768235,"text_s":0.575673,"denoise_s":0.854197,"vae_s":0.308082,"peak_mib":15532},"asi":{"hypothesis":"the default two offload streams contend for native CUDA copy bandwidth; one stream reduces scheduling pressure","baseline_s":2.368784,"improvement_pct":25.349,"quality_gate":"all matched PNGs pixel-identical","backend":"graph breaks 0; rogues 0","next_action_hint":"test three and four streams, then validate the best count at 768px"}}
{"type":"experiment","run":22,"metric":1.717825,"status":"keep","description":"cu130 native CUDA kernels with three async-offload streams","metrics":{"total_s":1.717825,"text_s":0.589239,"denoise_s":0.806072,"vae_s":0.290748,"peak_mib":15476},"asi":{"hypothesis":"three streams better overlap native CUDA weight faults while avoiding default two-stream overhead","baseline_s":1.768235,"improvement_pct":2.85,"quality_gate":"all matched PNGs pixel-identical","backend":"graph breaks 0; rogues 0","confidence_note":"two-run margin is near the observed noise floor; test four streams and repeat the leading settings before final selection","next_action_hint":"test four streams, then alternate the top stream counts"}}
{"type":"experiment","run":23,"metric":1.739621,"status":"discard","description":"cu130 native CUDA kernels with four async-offload streams","metrics":{"total_s":1.739621,"text_s":0.582136,"denoise_s":0.819401,"vae_s":0.306983,"peak_mib":15476},"asi":{"hypothesis":"a fourth stream improves overlap with native CUDA weight faults","baseline_s":1.717825,"improvement_pct":-1.269,"quality_gate":"all matched PNGs pixel-identical","rollback_reason":"warm median was 22ms slower than three streams and adds no measurable benefit","next_action_hint":"repeat three streams with more samples and select against one stream"}}
{"type":"experiment","run":24,"metric":1.698243,"status":"keep","description":"repeat confirmation of cu130 native CUDA kernels with three async-offload streams","metrics":{"total_s":1.698243,"total_mean_s":1.718602,"total_stdev_s":0.056204,"text_s":0.557681,"denoise_s":0.802029,"vae_s":0.303309,"peak_mib":15476,"measured_samples":3},"asi":{"hypothesis":"three streams provide the best robust native CUDA offload setting","baseline_s":1.717825,"improvement_pct":1.14,"quality_gate":"repeated matched PNGs pixel-identical to the original three-stream run","backend":"graph breaks 0; rogues 0","next_action_hint":"validate three streams at 768px, then profile text encoding and VAE"}}
{"type":"experiment","run":25,"metric":2.915651,"status":"keep","description":"cu130 native CUDA kernels with three async-offload streams at 768px","metrics":{"total_s":2.915651,"text_s":0.592897,"denoise_s":1.702127,"vae_s":0.554047,"peak_mib":15472},"asi":{"hypothesis":"three-stream scheduling preserves the native CUDA benefit at higher resolution","baseline_s":3.030086,"improvement_pct":3.77,"quality_gate":"all matched PNGs pixel-identical to the cu130 two-stream run","backend":"graph breaks 0; rogues 0","next_action_hint":"profile text encoding and VAE on the optimized 512px path"}}
{"type":"experiment","run":26,"metric":1.712486,"status":"discard","description":"cu130 stream-3 with cuDNN autotune","metrics":{"total_s":1.712486,"text_s":0.481301,"denoise_s":0.826106,"vae_s":0.374575,"peak_mib":15623,"min_free_mib":485},"asi":{"hypothesis":"cuDNN autotune can speed the convolution-heavy VAE enough to improve end-to-end latency","baseline_s":1.698243,"improvement_pct":-0.838,"quality_gate":"matched MAE about 0.096 and RMSE about 0.322; small numerical drift only","rollback_reason":"total latency did not improve, denoise and VAE regressed, peak VRAM rose 147 MiB, and minimum free VRAM fell 139 MiB","backend":"graph breaks 0; rogues 0","next_action_hint":"discard autotune; inspect the native Comfy Kitchen dense attention capability"}}
{"type":"experiment","run":27,"metric":1.735916,"status":"discard","description":"native cu130 W4A8 Qwen3VL text encoder with three offload streams","metrics":{"total_s":1.735916,"text_s":0.847104,"denoise_s":0.630901,"vae_s":0.225167,"peak_mib":13439,"min_free_mib":2669},"asi":{"hypothesis":"native cu130 w4a8_int8_linear can reduce text encoding enough to improve the warm path","baseline_s":1.728781,"improvement_pct":-0.413,"quality_gate":"failed; matched warm MAE about 5.7 and RMSE about 12.4-13.1","rollback_reason":"total latency was slightly worse, text encoding regressed 44%, and quality drift was large despite a roughly 2 GiB peak-VRAM reduction","backend":"graph breaks 0; rogues 0","next_action_hint":"retain the accepted INT8 text encoder"}}
{"type":"experiment","run":28,"metric":1.677688,"status":"discard","description":"native cu130 Comfy Kitchen INT8 attention with three offload streams","metrics":{"total_s":1.677688,"text_s":0.555579,"denoise_s":0.78411,"vae_s":0.307123,"peak_mib":15383,"min_free_mib":725},"asi":{"hypothesis":"native cu130 Comfy Kitchen attention can reduce Qwen dense-attention cost without a major scheduling regression","baseline_s":1.698243,"improvement_pct":1.21,"quality_gate":"failed; matched warm MAE 1.95-2.72 and RMSE 6.23-8.30","rollback_reason":"the 1.2% speedup is near noise and does not justify quantizing Q/K/V attention or the visible image drift","backend":"graph breaks 0; rogues 0","next_action_hint":"retain PyTorch SDPA and test the final untested async stream boundary"}}
{"type":"experiment","run":29,"metric":1.737736,"status":"discard","description":"cu130 native CUDA kernels with zero async-offload streams","metrics":{"total_s":1.737736,"text_s":0.566636,"denoise_s":0.827616,"vae_s":0.313317,"peak_mib":15430,"min_free_mib":678},"asi":{"hypothesis":"synchronous weight offload avoids copy-stream scheduling overhead on the small card","baseline_s":1.698243,"improvement_pct":-2.326,"quality_gate":"all matched PNGs pixel-identical","rollback_reason":"three streams remain faster; zero-stream performance was within the observed noise band but did not improve latency","backend":"graph breaks 0; rogues 0","next_action_hint":"retain three streams and test a 0.5 GiB reserve midpoint"}}
{"type":"experiment","run":30,"metric":1.708209,"status":"discard","description":"cu130 stream-3 with a 0.5 GiB VRAM reserve","metrics":{"total_s":1.708209,"text_s":0.574879,"denoise_s":0.803967,"vae_s":0.298793,"peak_mib":15302,"min_free_mib":806},"asi":{"hypothesis":"reducing the reserve from 1.0 GiB exposes enough VRAM to reduce weight churn","baseline_s":1.698243,"improvement_pct":-0.587,"quality_gate":"all matched PNGs pixel-identical","rollback_reason":"latency was within noise but did not improve; the 1.0 GiB reserve remains the primary-metric choice","memory_tradeoff":"minimum free VRAM improved by about 174 MiB","next_action_hint":"retain the 1.0 GiB reserve and inspect the exact prefix-cache hit path"}}
{"type":"experiment","run":31,"metric":1.710606,"status":"discard","description":"pre-baked INT8 ConvRot Turbo checkpoint with no runtime LoRA","metrics":{"total_s":1.710606,"text_s":0.541325,"denoise_s":0.789862,"vae_s":0.344894,"peak_mib":15331,"min_free_mib":777},"asi":{"hypothesis":"materializing the Turbo adapter removes 195 runtime weight patches and improves the warm path","baseline_s":1.698243,"improvement_pct":-0.728,"quality_gate":"failed; matched warm MAE 5.42-5.77 and RMSE 11.77-12.12","rollback_reason":"the corrected no-LoRA pre-bake was slightly slower and changed outputs materially; temporary INT8 serializer fix was reverted","next_action_hint":"retain the runtime Turbo LoRA path; do not adopt the candidate checkpoint"}}
{"type":"experiment","run":32,"metric":1.655577,"status":"keep","description":"final three-sample confirmation of cu130 native CUDA kernels with three async-offload streams","metrics":{"total_s":1.655577,"total_mean_s":1.656139,"total_stdev_s":0.016639,"text_s":0.534423,"denoise_s":0.797905,"vae_s":0.288254,"peak_mib":15339,"min_free_mib":769,"measured_samples":3},"asi":{"hypothesis":"the accepted cu130/stream-3 runtime remains fast and reproducible after all experiments","baseline_s":1.698243,"improvement_pct":2.514,"quality_gate":"decoded RGB pixels exactly identical to the accepted reference for all matched prompts; PNG container bytes differ only in metadata","backend":"native CUDA int8_linear; 195 runtime Turbo patches; graph breaks 0; rogues 0","decision":"final accepted 512px result"}}
{"type":"experiment","run":33,"metric":2.085519,"status":"keep","description":"final clean stock-loader v0.2.1 r128 six-step 512px","metrics":{"total_s":2.085519,"text_s":0.602064,"denoise_s":1.156417,"vae_s":0.303648,"peak_mib":15582,"min_free_mib":526,"measured_samples":5,"sampler_cached_measured":false},"asi":{"hypothesis":"r128 can serve as the quality default without the old rank-64 latency","quality_gate":"fixed-seed r128 six-step versus r256 six-step: CLIP image cosine 0.999572 and DINO image cosine 0.999034","result_file":"results/cu130_stream3_v021_final_r128_512_6step.json","backend":"native CUDA int8_linear; graph breaks 0; rogues 0"}}
{"type":"experiment","run":34,"metric":1.890984,"status":"keep","description":"final clean stock-loader v0.2.1 r128 five-step fast 512px","metrics":{"total_s":1.890984,"text_s":0.570453,"denoise_s":0.982212,"vae_s":0.295339,"peak_mib":15662,"min_free_mib":446,"measured_samples":5,"sampler_cached_measured":false},"asi":{"hypothesis":"publisher-supported five-step compromise is the fastest quality-gated v0.2.1 profile","baseline_s":2.085519,"improvement_pct":9.343,"quality_gate":"fixed-seed r128 five-step versus r256 six-step: CLIP image cosine 0.986657, DINO image cosine 0.965302, DINO L2 0.263433","result_file":"results/cu130_stream3_v021_final_r128_512_5step.json"}}
{"type":"experiment","run":35,"metric":3.343637,"status":"keep","description":"final clean stock-loader v0.2.1 r128 five-step fast 768px","metrics":{"total_s":3.343637,"text_s":0.626469,"denoise_s":2.078024,"vae_s":0.561162,"peak_mib":15588,"min_free_mib":520,"measured_samples":5,"sampler_cached_measured":false},"asi":{"hypothesis":"the selected fast profile scales to 768px while retaining GPU headroom","result_file":"results/cu130_stream3_v021_final_r128_768_5step.json","quality_gate":"no claim of 768px quality parity without expanded fixed-seed review"}}
{"type":"experiment","run":36,"metric":0.0,"status":"discard","description":"scale-one LoRA allocation reduction","metrics":{"optimized_elapsed_s":2.156177,"stock_elapsed_s":6.266823,"pixel_equal":true,"peak_mib_optimized":15575,"peak_mib_stock":15397},"asi":{"hypothesis":"avoid the full-size delta times one allocation at effective alpha/rank one","quality_gate":"clean matched prompt and seed produced pixel-identical output","rollback_reason":"latency comparison was cache-state-confounded and did not establish a repeatable win; source reverted to stock loader","next_action_hint":"instrument fault-time patch bytes before attempting an exact specialized bake"}}
{"type":"experiment","run":37,"metric":0.0,"status":"crash","description":"specialized exact INT8 ConvRot LoRA bake diagnostic","metrics":{"representative_weight_tests":["transformer_blocks.0.attn.to_q","transformer_blocks.0.img_mlp.out","transformer_blocks.0.img_mlp.gate_up"],"float_patch_math":"matched","quantized_byte_equivalence":"failed with small stochastic-rounding differences","checkpoint_written":false,"cuda_error":"illegal memory access during combined diagnostic"},"asi":{"hypothesis":"materialize v0.2.1 r128 using the runtime BF16 merge and ConvRot requantization path","quality_gate":"not applicable; no checkpoint was produced","rollback_reason":"representative float math matched, but quantized bytes differed and the combined diagnostic hit a CUDA illegal-memory-access","next_action_hint":"do not retry without an isolated per-layer seed and byte-equivalence harness"}}
{"type":"experiment","run":38,"metric":1.994375,"status":"keep","description":"post-restart smoke validation for v0.2.1 r128 five-step fast 512px","metrics":{"total_s":1.994375,"text_s":0.605129,"denoise_s":1.052122,"vae_s":0.311808,"peak_mib":15560,"min_free_mib":548,"measured_samples":3,"sampler_cached_measured":false},"asi":{"hypothesis":"the selected fast profile remains operational after restoring the lean server","quality_gate":"smoke validation only; no new quality claim","result_file":"results/cu130_stream3_v021_postrestart_r128_512_5step.json","note":"consistent with the final clean five-run result; retained as service-restart validation"}}
