{"type":"experiment","run":39,"metric":4.135252,"status":"baseline","description":"fresh r128 five-step control under current host memory state","metrics":{"total_s":4.135252,"text_s":1.670958,"denoise_s":2.228343,"vae_s":0.415992,"peak_mib":15646,"measured_samples":5,"sampler_cached_measured":false},"asi":{"hypothesis":"current r128 five-step path is a valid relative control despite environmental slowdown","quality_gate":"fixed-seed reference remains results/quality_v021/quality_v021_p1_r128_6_512_000","result_file":"results/research_v021_r128_5step_512_20260925.json","note":"host RAM and text-encode state differ from historical clean result; use relative A/B comparisons until service state is normalized"}}
{"type":"experiment","run":40,"metric":3.431632,"status":"discard","description":"fresh r128 two-step sigma truncation","metrics":{"total_s":3.431632,"text_s":1.299463,"denoise_s":1.541989,"vae_s":0.394867,"peak_mib":15513,"measured_samples":5,"sampler_cached_measured":false},"asi":{"hypothesis":"two evaluations of the accepted r128 student are faster enough to justify a two-step direction","quality_gate":"fixed-seed CLIP image cosine 0.850371; DINO image cosine 0.605056; DINO L2 0.888757; rejected","result_file":"results/research_quality_r128_2step_1step_vs_6step.json","rollback_reason":"quality collapses even though sampler latency falls relative to the fresh five-step control","next_action_hint":"test trained four-step student and custom trajectories, not r128 sigma truncation"}}
{"type":"experiment","run":41,"metric":3.362658,"status":"discard","description":"fresh r128 one-step sigma truncation","metrics":{"total_s":3.362658,"text_s":1.291784,"denoise_s":1.374297,"vae_s":0.396134,"peak_mib":15377,"measured_samples":5,"sampler_cached_measured":false},"asi":{"hypothesis":"one evaluation of the accepted r128 student is a viable one-step path","quality_gate":"fixed-seed CLIP image cosine 0.731693; DINO image cosine 0.439744; DINO L2 1.058543; structural collapse","result_file":"results/research_quality_r128_1step_fixed.json","rollback_reason":"severe quality collapse and no trained student artifact","next_action_hint":"do not reuse this schedule as a candidate"}}
{"type":"experiment","run":42,"metric":3.884400,"status":"discard","description":"on-disk baked four-step student at native four-step schedule","metrics":{"total_s":3.884400,"denoise_s":2.703742,"fixed_seed":true},"asi":{"hypothesis":"a genuine four-step student can serve as a better starting point for further compression","quality_gate":"fixed-seed CLIP image cosine 0.947919; DINO image cosine 0.924423; DINO L2 0.388785; below accepted r128 six-step quality","result_file":"results/research_quality_baked_4_2_1_vs_r128_6.json","rollback_reason":"native four-step baked student is materially below locked quality reference"}}
{"type":"experiment","run":43,"metric":1.326816,"status":"discard","description":"on-disk baked four-step student reduced to two evaluations","metrics":{"total_s":1.326816,"denoise_s":1.014744,"fixed_seed":true},"asi":{"hypothesis":"the genuine four-step baked student may tolerate a quality-preserving two-step trajectory","quality_gate":"fixed-seed CLIP image cosine 0.914863; DINO image cosine 0.803722; DINO L2 0.626543; rejected","result_file":"results/research_quality_baked_4_2_1_vs_r128_6.json","rollback_reason":"two-step truncation is not quality preserving despite being fast"}}
{"type":"experiment","run":44,"metric":0.747842,"status":"discard","description":"on-disk baked four-step student reduced to one evaluation","metrics":{"total_s":0.747842,"denoise_s":0.448082,"fixed_seed":true},"asi":{"hypothesis":"one-step baked student reaches the latency target","quality_gate":"fixed-seed CLIP image cosine 0.804299; DINO image cosine 0.458767; DINO L2 1.040417; structural collapse","result_file":"results/research_quality_baked_4_2_1_vs_r128_6.json","rollback_reason":"one-step quality is unacceptable despite sub-second fixed-seed execution"}}

{"run": 45, "commit": "local", "metric": 1.4067408, "status": "discard", "description": "genuine two-step Qwen-Image-2.1 student: r1 to_out.0 correction trained on 8 exact six-step teacher trajectories", "metrics": {"two_step_untrained_median_s": 1.4450994, "two_step_trained_median_s": 1.4067408, "accepted_five_step_s": 1.890984, "accepted_six_step_s": 2.085519, "dino_cosine_trained": 0.5215634, "dino_cosine_untrained": 0.5183333, "clip_cosine_trained": 0.8432935, "clip_cosine_untrained": 0.8490786, "dino_l2_trained": 0.978199, "train_steps": 8, "rank": 1}, "asi": {"hypothesis": "trained correction recovers six-step quality at the two-step schedule", "result": "fails the quality gate; trained student is statistically indistinguishable from no training at all", "rollback_reason": "DINO cosine 0.5216 vs 0.5183 and CLIP cosine 0.8433 vs 0.8491 are all worse than the untrained two-step baseline, so the eight LR-1e-4 updates changed nothing measurable", "dead_end": "trajectory MSE regression of a rank-1 attention output correction at 8 samples and 8 steps", "next_action_hint": "measure holdout loss before any further end-to-end run; a flat holdout means the objective or capacity is wrong, not under-trained", "files": ["scripts/train_qwen21_two_step.py", "scripts/eval_qwen21_student.py", "ComfyUI/comfy/ops.py", "ComfyUI/comfy/ldm/qwen_image21/model.py"]}, "timestamp": 1790349887454, "segment": 0}
{"run": 46, "commit": "local", "metric": 0.46405, "status": "discard", "description": "two-step student with holdout: 24 updates at LR 4e-4 with linear decay, 6 train and 2 holdout teacher samples", "metrics": {"holdout_seed48_before": 0.46706, "holdout_seed48_after": 0.46405, "holdout_seed49_before": 0.76459, "holdout_seed49_after": 0.76571, "train_elapsed_s": 66.71, "steps": 24, "rank": 1}, "asi": {"hypothesis": "a larger learning rate and more steps recover quality that the first attempt missed", "result": "holdout loss is flat within noise; training does not generalize to unseen prompts", "rollback_reason": "seed48 0.46706 to 0.46405 is a 0.6 percent change and seed49 0.76459 to 0.76571 moved the wrong way, so this is not a convergence signal", "dead_end": "escalating steps and learning rate on the same trajectory-regression objective", "next_action_hint": "the rank-1 output-projection correction has too little capacity for the two-step gap; next candidate must change the objective, not the step count", "files": ["scripts/train_qwen21_two_step.py"]}, "timestamp": 1790349887454, "segment": 0}
{"run": 47, "commit": "local", "metric": 0.0, "status": "keep", "description": "inference regression check: two ComfyUI training-path fixes are pixel-identical on the accepted six-step path", "metrics": {"control_vs_modified_mae": 0.0, "control_vs_modified_identical": true, "stored_vs_either_mae": 0.015108, "six_step_warm_s": 1.978959}, "asi": {"hypothesis": "the training-only guarded fixes to _gated_residual and cast_bias_weight do not alter accepted inference", "result": "confirmed; a control run on stashed-clean code produced a pixel-identical image (MAE 0.0)", "note": "the 0.015108 MAE against the stored accepted image reproduces identically with and without my edits, so it is pre-existing run-to-run nondeterminism in this stack, not a regression", "rollback_reason": "", "next_action_hint": "treat the accepted runtime as unchanged; the two fixes are training-only and safe to keep", "files": ["ComfyUI/comfy/ops.py", "ComfyUI/comfy/ldm/qwen_image21/model.py"]}, "timestamp": 1790350050668, "segment": 0}
{"run":48,"title":"Preregistration frozen for phase 2","verdict":"pass","artifacts":["research/PREREGISTRATION_2STEP.md","research/prediction_rival_matrix.csv"],"metrics":{"predictions":8,"matrix_status":"VALID_FOR_HUMAN_REVIEW","hypotheses":7},"conclusion":"Rivals, discriminating predictions, falsifiers, indeterminate outcomes, negative controls and decision rules were written and schema-validated before any new measurement. P7-LICENSING was moved out of the matrix into the compliance section because a licensing condition has no scientific rival."}
{"run":49,"title":"Harness validity control NC-HARNESS","verdict":"pass","artifacts":["results/p1b_cliff_quality.json"],"metrics":{"regenerated_six_step_dino_vs_locked_reference":0.999034,"recorded_six_step_dino":0.999034,"regenerated_pixel_mae":0.0015497,"recorded_pixel_mae":0.0015497,"nondeterminism_floor_mae":0.015108},"conclusion":"A regenerated six-step output at the locked prompt and seed 101 reproduces the stored locked reference to the recorded precision. The harness is valid. An earlier apparent failure at DINO 0.8665 was a seed error: the bench default is 42 while the lock is 101."}
{"run":50,"title":"Step-count quality curve locates the cliff between three and two steps","verdict":"pass","artifacts":["results/p1b_cliff_quality.json","results/frontier.md","results/frontier.json"],"metrics":{"dino_6step":0.999,"dino_5step":0.9653,"dino_4step":0.9499,"dino_3step":0.9339,"dino_2step_prescribed_grid":0.5503,"dino_2step_tuned_grid":0.8472,"dino_1step":0.4411,"loss_6_to_3":0.0651,"loss_3_to_2_prescribed":0.3836},"conclusion":"Six to three steps costs 0.065 DINO while three to two costs 0.384 on this cell. The cliff is between three and two steps. Single cell only, and the twelve-cell re-measurement in run 51 shows this cell is a favourable draw."}
{"run":51,"title":"Twelve-cell step-count comparison: three equals four, two is bimodal, one is non-functional","verdict":"pass","artifacts":["results/schedule_stepcount_generalization.json","scripts/schedule_generalization.py"],"metrics":{"combos":12,"prompts":4,"seeds":3,"mean_dino_1step":0.1997,"mean_dino_2step_prescribed":0.4446,"mean_dino_2step_tuned":0.6456,"mean_dino_3step":0.8345,"mean_dino_4step":0.8448,"median_dino_2step_tuned":0.7813,"min_dino_2step_tuned":0.1445,"min_dino_1step":-0.0143,"median_dino_1step":0.0879},"conclusion":"Three steps matches four steps on mean and median for one fewer denoiser call. Two steps has a heavy failure tail: median 0.7813 but mean 0.6456 and min 0.1445. One step is uncorrelated with the reference at the median. Every earlier quality number in this project rested on one cell that overstates quality by about 0.10, so the gate must be widened before further training."}
{"run":52,"title":"Two-step sigma grid search: schedule choice explains a large share of the recorded gap","verdict":"pass","artifacts":["results/p2_grid_quality.json","results/p2b_grid_quality.json","scripts/sweep_sigmas.py"],"metrics":{"dino_at_0.10":0.4228,"dino_at_0.25_prescribed":0.5503,"dino_at_0.40":0.6629,"dino_at_0.60":0.7138,"dino_at_0.75":0.8127,"dino_at_0.78":0.8472,"dino_at_0.85":0.793,"dino_at_0.90":0.7751,"best_minus_prescribed":0.2969,"optimum_bracketed":false},"conclusion":"Searching the second sigma moved DINO from 0.5503 to 0.8472 on the tuning cell with no training. The earlier correction experiment was trained to compensate for a poor target grid rather than a real student deficiency. The optimum is still at the edge of the searched range, so it is reported as a bound and the range must be widened. Grids starting below sigma 1.0 are rejected by the accepted harness. Per project rule this is an ablation, not a student."}
{"run":53,"title":"Latency floor model: one second is not reachable by step reduction on this card","verdict":"pass","artifacts":["results/latency_floor.json","results/sweep_p3b_floor.json","scripts/fit_latency_floor.py"],"metrics":{"denoise_model":"0.3654 + 0.1434*(N-1)","first_call_seconds":0.3654,"marginal_step_seconds":0.1434,"first_call_surcharge_seconds":0.222,"non_denoise_fixed_seconds":0.7799,"text_encode_seconds":0.483,"vae_decode_seconds":0.2735,"one_step_measured_seconds":1.1177,"one_step_predicted_seconds":1.1453,"zero_denoise_floor_seconds":0.7799,"max_abs_fit_residual_seconds":0.0223,"cached_runs":0},"conclusion":"A perfect one-step student lands at about 1.12 s with a short prompt and about 1.34 s on the accepted long-prompt profile, and the floor with no denoising is 0.78 s. The first-call surcharge of 0.2220 s exceeds the entire saving from two steps to one and from four to three, and it is LoRA plus ConvRot fault machinery rather than a quality term. Text encode plus VAE is 0.780 s and no denoiser work touches it."}
{"run":54,"title":"Accepted long-prompt protocol: three steps to two steps buys no measurable latency","verdict":"pass","artifacts":["results/sweep_p4_longprompt.json"],"metrics":{"five_step_seconds":2.3393,"four_step_seconds":2.1412,"three_step_seconds":2.0208,"two_step_tuned_seconds":2.0122,"three_vs_five_seconds_saved":0.3185,"three_vs_two_seconds_saved":0.0086,"accepted_session_five_step_seconds":1.890984,"session_overhead_ratio":1.237,"cached_runs":0,"gpu_throttle_reasons":"0x0"},"conclusion":"On the accepted long-prompt protocol, three steps is 0.319 s faster than five and matches four steps in quality, but three to two is 0.009 s which is inside run-to-run spread, while two steps loses 0.19 mean DINO and gains a failure tail. The two-step target is therefore not worth pursuing for latency on this card. Absolute latencies in this session run 20 to 45 percent above the recorded accepted session with no GPU throttling detected, so this session's absolutes are not comparable to accepted numbers and the one-step projection is a lower bound; only within-session ratios are used."}
